<?xml version="1.0" encoding="utf-8"?>

<World xmlns:xsi="http://www.w3.org/2001/XMLSchema-instance"
       xsi:noNamespaceSchemaLocation="../Schemas/schema_world.xsd">
    <Presentation>
        <StartSprite spriteId="5" />
        <Quote color="255 255 255 255">Cake or Pi?</Quote>
    </Presentation>
    <Levels>
        <Level>player-tile-collision-test.xml</Level>
        <Level>level_2-1.xml</Level>
        <Level>level_2-1--player-only.xml</Level>
        <Level>level_2.xml</Level>
        <Level>level_1.xml</Level>
        <Level>level_4.xml</Level>
    </Levels>
</World>